2016,https://doi.org/10.1021/acs.joc.6b00302,Carbohydrate,Fluorinated Carbohydrate Mimic,D-threo-hexopyranose,"2,3-dideoxy -2,2,3,3-tetrafluoro D -thereo hexopyranose",Potential inhibitor of carbohydrate-processing enzymes,"May have therapeutic potential in treating diseases involving carbohydrate metabolism, such as diabetes or viral infections"
2016,https://doi.org/10.1021/acs.joc.6b00302,Carbohydrate,Fluorinated Carbohydrate Mimic,D-threo-hexofuranose,"2,3-dideoxy -2,2,3,3-tetrafluoro D -thereo hexofuranose",Potential inhibitor of carbohydrate-processing enzymes,"May have therapeutic potential in treating diseases involving carbohydrate metabolism, such as diabetes or viral infections"
2016,https://doi.org/10.1021/acs.joc.6b00302,Carbohydrate,Fluorinated Carbohydrate Mimic,D-erythro-hexopyranose,"2,3-dideoxy -2,2,3,3-tetrafluoro D -erythro hexopyranose",Potential inhibitor of carbohydrate-processing enzymes,"May have therapeutic potential in treating diseases involving carbohydrate metabolism, such as diabetes or viral infections"
2016,https://doi.org/10.1021/acs.joc.6b00302,Carbohydrate,Fluorinated Carbohydrate Mimic,D-threo-hexopyranose,"3,4-dideoxy -3,3,4,4-tetrafluoro D -threo hexopyranose",Potential inhibitor of carbohydrate-processing enzymes,"May have therapeutic potential in treating diseases involving carbohydrate metabolism, such as diabetes or viral infections"
2016,https://doi.org/10.1021/acs.joc.6b00302,Carbohydrate,Fluorinated Carbohydrate Mimic,D-erythro-hexopyranose,"3,4-dideoxy -3,3,4,4-tetrafluoro D -erythro hexopyranose",Potential inhibitor of carbohydrate-processing enzymes,"May have therapeutic potential in treating diseases involving carbohydrate metabolism, such as diabetes or viral infections"
2016,https://doi.org/10.1089/jop.2015.0098,Protein,defensin mimetics,daptomycin,Brilacidine(PMX30063),eliminate FQrMRSA,Potential treatment for antibiotic-resistant bacterial infections through membrane depolarization
2016,https://doi.org/10.3389/fbioe.2015.00211,Protein,Synthetic peptide,CD4-binding site,CD4bs-M,inhibits HIV-1 entry,assembles into amyloid fibrils
2016,https://doi.org/10.3389/fbioe.2015.00211,Protein,Synthetic peptide,CD4-binding site,triazacyclophane scaffold,inhibits HIV-1 entry,Potential HIV-1 entry inhibitor by targeting the CD4 binding site
2016,https://doi.org/10.3389/fbioe.2015.00211,Protein,Synthetic peptide,CHR region of gp41,Sifuvirtide,active against Enfuvirtide-resistant HIV-1 strains.,"Treatment for HIV-1, including enfuvirtide-resistant strains, by blocking six-helical bundle formation"
2016,https://doi.org/10.3389/fbioe.2015.00211,Protein,Synthetic peptide,CD4,CD4M,inhibits HIV activity,Potential HIV-1 inhibitor by inducing conformational changes in gp120
2016,https://doi.org/10.3389/fbioe.2015.00211,Protein,Synthetic peptide,three ECLs of CXCR4,CX4-M1,inhibits HIV activity,Potential HIV-1 inhibitor by targeting CXCR4
2016,https://doi.org/10.3389/fphar.2016.00526,Protein,Incretin Mimetics,GLP-1,TT401,used for the treatment of complicated skin and skin structure infections and nosocomial pneumonia,"stimulate glucose-induced insulin secretion, suppress glucagon secretion and hepatic glucose production and delay gastric emptying"
2017,https://doi.org/10.1039/C7OB00386B,Carbohydrate,Nucleoside analogue,guanosine,Oxetanocin A,Inhibits viral DNA polymerases and reverse transcriptases,"Potent antiviral activity against HIV, HSV-1, HSV-2, and HCMV; potential antitumor and antibacterial properties"
2017,https://doi.org/10.1039/C7OB00386B,Carbohydrate,Glycoside analogue,Monosaccharides,Oxetanosides,Related to the synthesis of oxetanocin A and its analogues.,"Potential antiviral, antitumor, and antibacterial activities"
2017,https://doi.org/10.1039/C7OB00386B,Carbohydrate,Thietanose analogue,furanose sugars,Thietanose,Designed as a carbohydrate mimic with potential applications in organic chemistry.,Potential anti-HIV activity
2017,https://doi.org/10.1039/C7OB00386B,Carbohydrate,Thiethane analogue,furanose sugars,Pseudothietanose,Related to the synthesis of thietanose analogues.,Potential anti-HIV activity
2017,https://doi.org/10.1080/1040841X.2016.1242868,Carbohydrate,Iminosugar,Castanospermine,6-O-butanoyl castanospermine (BuCAST),Inhibitor of glycosphingolipid biosynthesis and glucosidases,Reduced murine brain viral load of herpes simplex virus type 1 (HSV-1) following cutaneous infection; tested in vivo against a range of influenza virus strains with reduced pathology and increased survival in murine lethal infection models
2017,https://doi.org/10.1080/1040841X.2016.1242868,Carbohydrate,Iminosugar,Sialic acid,3-episiastatin B,Neuraminidase inhibitor,Potent inhibitory activities against influenza virus neuraminidases and influenza virus infection
2017,https://doi.org/10.1080/1040841X.2016.1242868,Carbohydrate,Iminosugar,Deoxynojirimycin (DNJ),N-nonyl-deoxynojirimycin (N N-DNJ),Inhibitor of glycosphingolipid biosynthesis and glucosidases,Reduced secretion of glycoproteins E and NS1 and virion production in dengue virus (DENV) and Japanese encephalitis virus (JEV); reduced mortality rate in a JEV mouse lethal challenge model
2017,https://doi.org/10.1080/1040841X.2016.1242868,Carbohydrate,Iminosugar,Deoxynojirimycin (DNJ),N-(9-methoxynonyl)-1-deoxynojirimycin (M O N-DNJ),Inhibitor of glycosphingolipid biosynthesis and glucosidases,Demonstrated protective effects against lethal doses of H1N1 influenza viruses and reduced mortality rate in a mouse lethal challenge model
2017,https://doi.org/10.1016/j.carres.2017.03.012,Carbohydrate,Inositol Mimic,Rhamnopyranoside residue of a trisaccharide,Inositol Analogues,Potential use in synthetic vaccines,"May lead to more effective and stable vaccines against bacterial infections, particularly those with capsular polysaccharides"
2017,https://pubmed.ncbi.nlm.nih.gov/27411325/,Protein,tripeptide,tryptophan,LTX-109,treats impetigo and nasal decolonization.,Treats impetigo and nasal decolonization
2017,https://pubmed.ncbi.nlm.nih.gov/27411325/,Protein,Lipo-peptidomimetic,Antimicrobial peptides,colistin/Polymyxin B,essential for their antimicrobial activities,Antimicrobial agent for treating resistant bacterial infections
2017,https://doi.org/10.3390/molecules22071217,Protein,defensin mimetics,Defensins,telavancin,inhibits bacterial cell wall syntheisis,used for the treatment of complicated skin and skin structure infections and nosocomial pneumonia
2017,https://doi.org/10.3390/molecules22071217,Protein,defensin mimetics,Defensins,Dalbavancin,inhibits bacterial cell wall syntheisis,used for the treatment of complicated skin and skin structure infections and nosocomial pneumonia
2017,https://doi.org/10.3390/molecules22071217,Protein,defensin mimetics,Defensins,Oritavancin,inhibits bacterial cell wall syntheisis,used for the treatment of complicated skin and skin structure infections and nosocomial pneumonia
2017,https://doi.org/10.3390/molecules22071217,Protein,defensin mimetics,Defensins,Anidulafungin,"inhibits Fungal 1,3-β-d-glucan synthase",used for the treatment of complicated skin and skin structure infections and nosocomial pneumonia
2017,https://doi.org/10.1002/acn3.399,Protein,Apolipoprotein,Apolipoprotein E,CN-105,improves outcomes in ischemic stroke,reduces proinflammatory pathways and lower oxidative stress
2017,http://doi.org/10.1371/journal.pone.0185653,Protein,Not Specified Explicitly,Insulin,Milk-Derived Peptides (IPP and VPP),: These peptides have ACE-inhibitory and anti-inflammatory properties.,"They promote the differentiation of pre-adipocytes, similar to insulin's effects on adipose tissue"
2018,https://doi.org/10.1002/chem.201705469,Carbohydrate,Glycomimetics (heparin-related),Natural heparin,Heparin-related glycopolymers,"These glycomimetics function as anticoagulants by modulating the interaction with antithrombin III, enhancing its ability to inhibit coagulation factors","The glycopolymers exhibit anticoagulant activity that can surpass that of natural heparin, demonstrating improved efficacy in blood coagulation inhibition"
2018,https://doi.org/10.1002/chem.201705471,Carbohydrate,Glycomimetics (β-(1→3) glucan mimetics),Natural β-(1→3) glucans,Hydroxylamine-based di- and tri-oligomers of β-(1→3) glucans,"These mimetics are designed to bind to complement receptors and stimulate immune responses, such as phagocytosis","The biological results indicate that these glycomimetics can stimulate phagocytosis in a length-dependent manner, with the trimer mimetic showing significant activity"
2018,https://doi.org/10.1016/j.aca.2017.11.047,Carbohydrate,"Monosaccharide (specifically, a hexose).",Methyl α-D-mannopyranoside,MYWYPY,Inhibits the binding of methyl α-D-mannopyranoside to concanavalin A (ConA),"Interacts with the protein at or near the carbohydrate binding site, acting as an inhibitor"
2018,https://doi.org/10.1016/j.aca.2017.11.051,Carbohydrate,Monosaccharide,Galactose,"YXY (where X can be alanine, glutamic acid, threonine, or tyrosine)",Selectively interacts with several galactose recognition proteins,"Peptides containing the YXY sequence were designed to evaluate the interaction with galactose-binding proteins, showing selective binding"
2018,https://doi.org/10.1016/j.aca.2017.11.052,Carbohydrate,Peptidoglycan-derived carbohydrate,N-acetylglucosaminyl-β1-4-N-acetylmuramyl-alanyl-d-isoglutamine (GMDP),Peptide mimics of N-acetylglucosaminyl-β1-4-N-acetylmuramyl-alanyl-d-isoglutamine (GMDP),Demonstrated adjuvant activities,Induces immune responses through the production of anti-carbohydrate antibodies
2019,https://doi.org/10.3390/biomimetics4030053,Carbohydrate,Glycan,Neuraminic acid,Oseltamivir (Tamiflu),Antiviral drug used for the treatment and prophylaxis of influenza A and B.,"Inhibits neuraminidase, an enzyme on the surface of the influenza virus, which is essential for the virus's replication and spread."
2019,https://doi.org/10.3390/biomimetics4030054,Carbohydrate,Glycan,Neuraminic acid,Zanamivir (Relenza),Antiviral drug used for the treatment of influenza A and B.,"Inhibits neuraminidase, preventing the release of new viral particles from infected cells."
2019,https://doi.org/10.3390/biomimetics4030057,Carbohydrate,Glycan,Multivalent carbohydrate structure,Multivalent glycomimetics,Used to enhance binding affinity through multivalent interactions.,"Binds to multiple sites on a target protein or cell surface, increasing overall binding strength and efficacy."
2019,https://doi.org/10.1007/s11130-019-00723-z,Carbohydrate,Carbohydrate-based fat mimetics,"Fats (specifically, saturated fats in bakery products)",Inulin,Inulin serves to reduce fat content in bakery products while providing similar textural and mouthfeel properties to fats,"Inulin promotes the endogenous formation of 3-MCPDE during baking, particularly at higher concentrations, due to the formation of Maillard products."
2019,https://doi.org/10.1007/s11130-019-00723-z,Carbohydrate,Carbohydrate-based fat mimetics,"Fats (specifically, saturated fats in bakery products)",Pectin,Pectin serves to reduce fat content in bakery products while providing similar textural and mouthfeel properties to fats,"Pectin helps maintain lower levels of glycidyl esters during baking and storage due to its ability to bind water and create a stable gel matrix, which affects the thermal stability of these compounds."
2019,https://doi.org/10.3390/ijms20081963,Protein,Not Specified Explicitly,Neutrophil serine proteases,Kanamycin-based Compound (KanCbz):,"Acts as a potent inhibitor of these proteases, which are involved in inflammatory lung conditions.",Demonstrated effectiveness in attenuating inflammation mediated by proteases
2019,https://doi.org/10.1002/adfm.202402521,Protein,Not Specified Explicitly,CXCR3 Receptor,CXCR3 Antagonist (AMG487),"The CXCR3 receptor is involved in the recruitment and differentiation of osteoclast precursors at bone resorption sites. By blocking this receptor, the antagonist aims to mitigate osteoclast activity and bone loss.","The PS-EMs loaded with AMG487 effectively protect against bone loss in an ovariectomized mouse model, demonstrating their potential as anti-resorptive therapies."
2019,https://doi.org/10.1021/acs.bioconjchem.9b00259,Protein,Synthetic antibody-like peptide.,Yeast regulatory protein Gal80.,Synbody,"Exhibits a high affinity (5 nM) for Gal80, significantly enhancing binding compared to monomeric peptides. This synbody binds to two different faces of the protein, mimicking the behavior of natural antibodies.","Synbody functions as a high-affinity protein interaction inhibitor by mimicking discontinuous epitopes of target proteins, enabling selective binding to disrupt pathogenic protein-protein interactions (PPIs) or modulate signaling pathways."
2020,https://doi.org/10.1002/ejoc.202001389,Carbohydrate,Azidopyran,3-Azidopyran,"Trivalent 1,2,3-Triazole-Linked Carbohydrate Mimetics (6-8)","Serve as multivalent ligands for biological targets, enhancing effects compared to monovalent ligands.","Used for their potential as L- and P-selectin ligands, showing promise in preliminary evaluations"
2020,https://doi.org/10.1002/ejoc.202001389,Carbohydrate,Azidopyran,3-Azidopyran,Unsymmetrical Trivalent Carbohydrate Mimetic (12),"Multivalent interaction with biological targets, potentially more effective due to asymmetry.","Evaluated as L- and P-selectin ligands, successfully O-sulfated to enhance activity​"
2020,https://doi.org/10.1002/ejoc.202001389,Carbohydrate,Azidopyran,3-Azidopyran,"Tetravalent 1,2,3-Triazole-Linked Carbohydrate Mimetic (16)",Multivalent ligands for enhancing biological interactions.,"Synthesized for evaluation as a ligand for selectins, showing good yield and potential"
2020,https://doi.org/10.1002/ejoc.202001389,Carbohydrate,Azidopyran,3-Azidopyran,"Hexavalent 1,2,3-Triazole-Linked Carbohydrate Mimetic (17)",Designed to enhance multivalent biological interactions.,"Evaluated as a selectin ligand, showing good reactivity and yield​"
2020,https://doi.org/10.1002/ejoc.202001389,Carbohydrate,Azidopyran,3-Azidopyran,"Octavalent 1,2,3-Triazole-Linked Carbohydrate Mimetic (18)","Provides multiple binding sites for biological targets, enhancing effectiveness.","Synthesized with good yield, evaluated for potential selectin binding​"
2020,https://doi.org/10.1002/ejoc.202001389,Carbohydrate,Azidopyran,3-Azidopyran,Dodecavalent C60-Fullerene Derived Carbohydrate Mimetic (22),Provides extensive multivalent interaction potential with biological targets.,"Preliminary SPR measurements indicate promising ligand activity for L- and P-selectins with low nanomolar IC50 values, successfully O-sulfated for enhanced activity​."
2020,https://doi.org/10.3390/ijms21197349,Protein,Antimicrobial peptide mimetic,Natural antimicrobial peptide from wasp venom,Protonectin,Exhibits antifungal and antibacterial activity.,"Membrane-active mode of action, effective against various pathogens."
2020,https://doi.org/10.3390/ijms21197349,Protein,Antimicrobial peptide mimetic,Natural peptide found in frog skin.,Temporin-SHf,Provides a chemical defense against pathogens.,Moderate antimicrobial activity against E. coli and S. aureus.
2020,https://doi.org/10.3390/ijms21197349,Protein,Antimicrobial peptide mimetic,Analogue of Temporin-SHf.,TetraF2W-RR,Enhanced antimicrobial properties.,Improved activity against MRSA and other bacteria.
2020,https://doi.org/10.3390/ijms21197349,Protein,Antimicrobial peptide mimetic,Upgraded versions of Temporin.,Verine-L,Targeting bacterial infections.,Enhanced antimicrobial activity against S. aureus and E. coli.
2020,https://doi.org/10.3390/ijms21197349,Protein,Antimicrobial peptide mimetic,Upgraded versions of Temporin.,Horine,Targeting bacterial infections.,Enhanced antimicrobial activity against S. aureus and E. coli.
2020,https://doi.org/10.3390/ijms21197349,Protein,Peptidomimetic oligomers,Host-defense peptides.,g-AApeptides,Mimics the action of natural AMPs.,"mimic the primary structure of natural peptides, projecting a similar number of side chains, which allows them to interact effectively with bacterial membranes. They fold into discrete secondary structures, such as helical and β-turn-like formations, which are crucial for their function"
2020,https://doi.org/10.3390/ijms21197349,Protein,Peptidomimetic oligomers,Cyclic peptide antibiotics.,Cyclic g-AApeptides,Antimicrobial action.,"disrupt bacterial membranes. Their unique structure allows them to adopt a globally amphipathic conformation, which is essential for interacting with and permeabilizing bacterial membranes"
2021,https://doi.org/10.1186/s13046-021-02157-5,Protein,Macromolecular drug carrier.,Various pro-apoptotic proteins,ELPs (Elastin-like polypeptides),"Enhances solubility and delivery of therapeutics,",electively accumulating in tumors to promote apoptosis
2021,https://doi.org/10.1002/anie.202102082,Protein,Peptidomimetic inhibitor,β-catenin,Bicyclic b-Sheet Mimetics (A-b6),"Inhibits the interaction between β-catenin and transcription factors, thereby blocking Wnt signaling.",Demonstrated robust Wnt inhibition with an IC50 of 8 µM and high inhibitory activity at 50 µM (2% residual activity)
2021,https://doi.org/10.1002/anie.202102082,Protein,Peptidomimetic inhibitor,β-catenin,Linear Analog (12-l),"Similar target as A-b6 and 12, aimed at inhibiting β-catenin interactions.",Exhibited low affinity (Kd approx. 2 mM) and reduced signal intensity due to proteolytic degradation
2021,https://doi.org/10.3390/bioengineering8010005,Protein,Not Specified Explicitly,Collagen triple helix.,Homotrimeric Collagen mimetic peptides (CMPs),"These peptides self-assemble into stable triple helices, mimicking the structural integrity of natural collagen.","They exhibit thermal stability and can facilitate the formation of higher-order structures, which are essential for tissue engineering applications."
2021,https://doi.org/10.3390/bioengineering8010005,Protein,Not Specified Explicitly,natural collagen with diverse amino acid sequences.,Heterotrimeric CMPs,Designed to form more complex structures that resemble the natural collagen fibrils found in tissues.,These CMPs can enhance the mechanical properties of biomaterials and improve cell interactions.
2021,https://doi.org/10.3390/bioengineering8010005,Protein,Not Specified Explicitly,Collagen and its functional domains.,Recombinant CMPs,"These peptides are produced using recombinant DNA technology, allowing for precise control over their sequence and structure.",They provide insights into collagen's molecular interactions and can be tailored for specific biomedical applications.
2021,https://doi.org/10.3390/bioengineering8010005,Protein,Not Specified Explicitly,Collagen and other ECM components.,Synthetic ECM Mimics,These materials aim to replicate the nano-scale structure and function of collagen.,They can support cell growth and tissue regeneration by providing a suitable environment for cellular activities.
2022,https://doi.org/10.1016/j.addr.2021.114044,Protein,Not Specified Explicitly,NEMO/IKKb interaction,Bicyclic peptides,Inhibits NEMO/IKKb interaction.,Affects NF-kB signaling pathway.
2022,https://doi.org/10.1016/j.addr.2021.114044,Protein,Not Specified Explicitly,BCL9 protein,Heptapeptides,Mimics the α-helical domain of BCL9.,Inhibits β-catenin interaction.
2022,https://doi.org/10.1016/j.addr.2021.114044,Protein,Not Specified Explicitly,Host defense peptide,cTI (tachyplesin-I),Antimicrobial activity.,Induces apoptosis in cancer cells.
2022,https://doi.org/10.1016/j.addr.2021.114044,Protein,Immunomodulatory mimetic.,Interleukin-2 (IL-2),IL-2-derived peptides,Enhances T-cell activation.,Boosts immune response against tumors.
2022,https://doi.org/10.1016/j.addr.2021.114044,Protein,Not Specified Explicitly,L2,Human Papillomavirus Minor Capsid Protein L2,Involved in viral entry into host cells.,Facilitates infection.
2022,https://doi.org/10.1021/acscentsci.1c01293,Protein,Cytokine mimetic,Interleukin-2 (IL-2) and Interleukin-15 (IL-15),Neo-2/15,"Potently activates and expands cytotoxic CD8+ T cells and NK cells, supporting antitumor immunity with reduced toxicity","Mimics IL-2 and IL-15 signaling by selectively binding IL-2Rβγc, driving immune cell activation without engaging CD25, thus minimizing side effects"
2023,https://doi.org/10.1039/D2CS00954D,Carbohydrate,iminosugars,"biologically active carbohydrates uch as sialic acid, glucose, maltose, and other glycan epitopes-examples include oseltamivir (Tamiflu)",Glycomimetic,Inhibition and modulation of lectins,"inhibit carbohydrate-processing enzymes or block lectin-mediated interactions, thereby modulating biological processes like viral infection, cancer metastasis"
2023,https://doi.org/10.1021/acs.jmedchem.3c01412,Protein,Not Specified Explicitly,p53,Sulfono-γ-AApeptides,Blocking the interaction of p53 with its negative regulators MDM2 or MDMX.,"This  restores p53’s tumor-suppressing activity, potentially leading to cancer cell apoptosis."
2023,https://doi.org/10.1021/acs.jmedchem.3c01412,Protein,Not Specified Explicitly,GLP-1,Sulfono-γ-AApeptides,treatment of type 2 diabetes.,"Mimicry of GLP-1, which is involved in glucose regulation by stimulating insulin secretion."